{
  "schemaVersion": 1,
  "service": { "key": "ailytics", "displayName": "Ailytics" },
  "runtime": { "handler": "index.handler", "language": "javascript", "moduleFormat": "commonjs" },
  "routes": [
    { "method": "GET", "path": "/version", "kind": "diagnostic", "authentication": "none" },
    { "method": "POST", "path": "/get-supabase-configs", "kind": "diagnostic", "authentication": "none" },
    { "method": "POST", "path": "/get-telegram-group-discoveries", "kind": "diagnostic", "authentication": "lambda-auth" },
    { "method": "POST", "path": "/telegram-webhook", "kind": "webhook", "authentication": "none" },
    { "method": "POST", "path": "/ailytics-safety/whatsapp-events", "kind": "webhook", "authentication": "none" },
    { "method": "POST", "path": "/ailytics-safety/status-summary", "kind": "scheduled", "authentication": "none" },
    { "method": "POST", "path": "/ailytics-safety/yesterday-24h-summary", "kind": "scheduled", "authentication": "none" },
    { "method": "POST", "path": "/ailytics-safety/retry-pending-deliveries", "kind": "scheduled", "authentication": "none" },
    { "method": "POST", "path": "/ailytics-safety/test-reply-resend", "kind": "diagnostic", "authentication": "lambda-auth" }
  ],
  "configuration": {
    "schema": "ailytics",
    "table": "project_configs",
    "identityColumn": "id",
    "fields": {
      "id": { "label": "Row ID", "group": "identity", "mutable": false, "role": "identity", "help": "Database-generated UUID referenced by every Ailytics child table." },
      "project_code": { "label": "Project code", "group": "identity", "mutable": false, "role": "identity", "help": "Unique human project identity; unlike sibling services, it is not the primary key." },
      "company": { "label": "Company", "group": "identity", "mutable": true, "role": "configuration", "help": "Operator-facing identity only; Ailytics runtime behavior does not read it." },
      "enabled": { "label": "Telegram intake enabled", "group": "intake", "mutable": true, "role": "feature-flag", "help": "Stops new Telegram alerts but does not prevent existing WhatsApp-linked issues from closing (INV-AIL-15)." },
      "timezone": { "label": "Timezone", "group": "identity", "mutable": true, "role": "configuration", "help": "Used for sheet timestamp rendering; only Asia/Singapore has been exercised." },
      "telegram_chat_id": { "label": "Telegram chat ID", "group": "intake", "mutable": true, "role": "configuration", "help": "First half of the Telegram intake match; unknown onboarding values use an empty string (INV-AIL-09)." },
      "upstream_bot_username": { "label": "Upstream bot username", "group": "intake", "mutable": true, "role": "configuration", "help": "Case-insensitive intake identity with a leading @ ignored; paired uniquely with the chat ID (INV-AIL-09/16)." },
      "expected_chat_title": { "label": "Expected chat title", "group": "intake", "mutable": true, "role": "configuration", "help": "Informational note only; it is never used to match Telegram intake." },
      "spreadsheet_id": { "label": "Spreadsheet ID", "group": "sheets", "mutable": true, "role": "configuration", "help": "Workbook for both projections; the service account needs Editor access because tabs are created on demand (INV-AIL-07)." },
      "activity_history_tab": { "label": "Activity history tab", "group": "sheets", "mutable": true, "role": "configuration", "help": "Projection tab; write the live (CODE) CCTV History convention explicitly rather than relying on the legacy default (INV-AIL-08)." },
      "safety_sheet_tab": { "label": "Safety sheet tab", "group": "sheets", "mutable": true, "role": "configuration", "help": "Projection tab; write the live (CODE) CCTV Safety Sheet convention explicitly rather than relying on the legacy default (INV-AIL-08)." },
      "lambda_url": { "label": "Send-message URL", "group": "delivery", "mutable": true, "role": "configuration", "help": "Text delivery endpoint." },
      "lambda_url_image": { "label": "Send-document URL", "group": "delivery", "mutable": true, "role": "configuration", "help": "Normal image endpoint. A Non-Compliant reply derives the companion /reply-document URL by replacing this final route segment." },
      "reply_lambda_url": { "label": "Reply-message URL", "group": "delivery", "mutable": true, "role": "configuration", "help": "Listener endpoint used for threaded WhatsApp replies." },
      "instance_name": { "label": "WhatsApp instance", "group": "delivery", "mutable": true, "role": "configuration", "help": "Listener instance; unknown onboarding values use an empty string rather than null (INV-AIL-09)." },
      "client_id": { "label": "Client ID", "group": "delivery", "mutable": true, "role": "configuration", "help": "Sending-account identifier; unknown onboarding values use an empty string rather than null (INV-AIL-09)." },
      "whatsapp_group_ids": { "label": "WhatsApp groups", "group": "delivery", "mutable": true, "role": "configuration", "help": "Comma-separated destinations, trimmed and de-duplicated per send (INV-AIL-17)." },
      "forward_pending_to_whatsapp": { "label": "Forward pending alerts", "group": "behavior", "mutable": true, "role": "feature-flag", "help": "Gates only the delivery attempt; capture and history writes continue, and PENDING requires confirmed delivery (INV-AIL-14/19)." },
      "reply_closed_in_wa_when_compliant": { "label": "React ✅ when Compliant", "group": "behavior", "mutable": true, "role": "feature-flag", "help": "When Telegram marks a pending activity COMPLIANT, react ✅ to its previously forwarded WhatsApp message. COMPLIANT remains a non-issue and never creates a safety-sheet row (INV-AIL-22)." },
      "status_summary_enabled": { "label": "Status summary enabled", "group": "behavior", "mutable": true, "role": "feature-flag", "help": "Allows project-local sheet counts to be sent; this is not an estate-wide aggregate (INV-AIL-18)." },
      "yesterday_summary_enabled": { "label": "Yesterday summary enabled", "group": "behavior", "mutable": true, "role": "feature-flag", "help": "Enables the hourly previous-local-day Ailytics findings summary route without changing the existing status summary behavior." },
      "yesterday_summary_hour": { "label": "Yesterday summary hour", "group": "behavior", "mutable": true, "role": "configuration", "help": "Local project hour from 0 to 23 at which the hourly route is allowed to send the previous day's summary." },
      "yesterday_summary_group_ids": { "label": "Yesterday summary WhatsApp groups", "group": "delivery", "mutable": true, "role": "configuration", "help": "Comma-separated dedicated Safety Inspection Summary WhatsApp group IDs; this does not reuse whatsapp_group_ids." },
      "mention_targets": { "label": "WhatsApp mention targets", "group": "delivery", "mutable": true, "role": "configuration", "help": "Controls optional camera-to-contact mentions on Pending and Non-Compliant image captions, with separate shift windows and exact-camera-before-any matching." },
      "created_at": { "label": "Created at", "group": "runtime", "mutable": false, "role": "runtime-state", "help": "Database-owned audit timestamp." },
      "updated_at": { "label": "Updated at", "group": "runtime", "mutable": false, "role": "runtime-state", "help": "Database-owned optimistic-concurrency timestamp." }
    },
    "constraints": [
      { "name": "project_configs_project_code_key", "help": "Project codes are unique." },
      { "name": "project_configs_telegram_chat_id_upstream_bot_username_key", "help": "Only one row may use a Telegram chat ID and bot-username pair, including a fully blank draft pair (INV-AIL-09)." }
    ]
  },
  "health": {
    "scheduleTimezone": "UTC",
    "schedules": [
      {"key":"ailytics-resolve","route":"/ailytics-safety/retry-pending-deliveries","name":"Ailytics resolve queue","minutes":[0,1,2,3,4,5,6,7,8,9,10,11,12,13,14,15,16,17,18,19,20,21,22,23,24,25,26,27,28,29,30,31,32,33,34,35,36,37,38,39,40,41,42,43,44,45,46,47,48,49,50,51,52,53,54,55,56,57,58,59],"hours":[0,1,2,3,4,5,6,7,8,9,10,11,12,13,14,15,16,17,18,19,20,21,22,23]},
      {"key":"ailytics-yesterday","route":"/ailytics-safety/yesterday-24h-summary","name":"Ailytics yesterday summary","minutes":[0],"hours":[0,1,2,3,4,5,6,7,8,9,10,11,12,13,14,15,16,17,18,19,20,21,22,23]},
      {"key":"ailytics-fail-catch","route":"/ailytics-safety/retry-pending-deliveries","name":"Ailytics fail catch","minutes":[35],"hours":[0,1,2,3,4,5,6,7,8,9,10,11,12,13,14]},
      {"key":"ailytics-status","route":"/ailytics-safety/status-summary","name":"Ailytics issues summary","minutes":[0],"hours":[10]}
    ],
    "granularity": { "ingestion": "none", "run": "project", "delivery": "project" },
    "statuses": { "pending": "green", "queued": "green", "sent": "green", "unconfirmed": "amber", "failed": "red" }
  }
}
