{
  "schemaVersion": 1,
  "service": {
    "key": "vibration",
    "displayName": "Vibration"
  },
  "runtime": {
    "handler": "index.handler",
    "language": "javascript",
    "moduleFormat": "commonjs"
  },
  "routes": [
    {
      "method": "GET",
      "path": "/api/version",
      "kind": "diagnostic",
      "authentication": "none"
    },
    {
      "method": "GET",
      "path": "/version",
      "kind": "diagnostic",
      "authentication": "none"
    },
    {
      "method": "POST",
      "path": "/api/vibration-scrape",
      "kind": "scheduled",
      "authentication": "optional-service-key"
    },
    {
      "method": "POST",
      "path": "/test-notification",
      "kind": "diagnostic",
      "authentication": "optional-service-key"
    },
    {
      "method": "POST",
      "path": "/api/test-notification",
      "kind": "diagnostic",
      "authentication": "optional-service-key"
    },
    {
      "method": "POST",
      "path": "/api/vibration-report",
      "kind": "operator",
      "authentication": "optional-service-key"
    },
    {
      "method": "POST",
      "path": "/api/vibration-kickoff",
      "kind": "scheduled",
      "authentication": "optional-service-key"
    },
    {
      "method": "POST",
      "path": "/api/vibration-alert-preview",
      "kind": "operator",
      "authentication": "optional-service-key"
    }
  ],
  "configuration": {
    "schema": "vibration",
    "table": "vibration_project_configs",
    "identityColumn": "project_code",
    "fields": {
      "project_code": {
        "label": "Project code",
        "group": "identity",
        "mutable": false,
        "role": "identity",
        "help": "Stable site identity; it names the project's physical readings table <code>_vibration_data_daily."
      },
      "company": {
        "label": "Company",
        "group": "identity",
        "mutable": true,
        "role": "configuration",
        "help": "Operator-facing identity only; scraping does not read it."
      },
      "site_name": {
        "label": "Site name",
        "group": "identity",
        "mutable": true,
        "role": "configuration",
        "help": "Human name of the site shown to operators."
      },
      "timezone": {
        "label": "Timezone",
        "group": "identity",
        "mutable": true,
        "role": "configuration",
        "help": "IANA timezone used to interpret the site's reading times."
      },
      "config_kind": {
        "label": "Row kind",
        "group": "runtime",
        "mutable": false,
        "role": "runtime-state",
        "help": "'site' rows are HALO cards; 'legacy_target' rows are WIRS inputs and are never listed."
      },
      "enabled": {
        "label": "Project enabled",
        "group": "status",
        "mutable": true,
        "role": "feature-flag",
        "help": "Gates scraping: the scraper reads only the source targets of enabled site rows (see supabase/migrate_site_enabled_gates_scraping.sql). A new site is created disabled, so enable it before its first scrape. Disabling stops scraping; the site's readings table and rows stay."
      },
      "vibration_kickoff_enabled": {
        "label": "Morning vibration kickoff",
        "group": "delivery",
        "mutable": true,
        "role": "feature-flag",
        "help": "Include this enabled project in the morning kickoff report. The report sends the latest per-meter PPV and most recent project scrape status to the project's configured WhatsApp groups; it does not trigger a scrape."
      },
      "client_id": {
        "label": "Client ID",
        "group": "delivery",
        "mutable": true,
        "role": "configuration",
        "help": "Sending-account identifier for the manual site PPV report or legacy diagnostic notification."
      },
      "instance_name": {
        "label": "WhatsApp instance",
        "group": "delivery",
        "mutable": true,
        "role": "configuration",
        "help": "Listener instance used by the manual site PPV report or legacy diagnostic notification."
      },
      "lambda_url": {
        "label": "Send-message URL",
        "group": "delivery",
        "mutable": true,
        "role": "configuration",
        "help": "Listener text endpoint used by the manual site PPV report or legacy diagnostic notification."
      },
      "wa_group_ids": {
        "label": "Notification groups",
        "group": "delivery",
        "mutable": true,
        "role": "configuration",
        "help": "Groups receiving an explicitly sent site PPV report or legacy diagnostic notification; scraping never messages them."
      },
      "vibration_formatter": {
        "label": "Vibration alert format",
        "group": "alerts",
        "mutable": true,
        "role": "configuration",
        "options": ["SKW_format"],
        "help": "Formatter used by automatic PPV threshold alerts. SKW_format is the current alert wording."
      },
      "created_at": {
        "label": "Created at",
        "group": "runtime",
        "mutable": false,
        "role": "runtime-state",
        "help": "Database-owned audit timestamp."
      },
      "updated_at": {
        "label": "Updated at",
        "group": "runtime",
        "mutable": false,
        "role": "runtime-state",
        "help": "HALO-managed optimistic-concurrency timestamp."
      }
    },
    "constraints": []
  },
  "health": {
    "granularity": {
      "ingestion": "project",
      "run": "service",
      "delivery": "none"
    },
    "statuses": {
      "scraped": "green",
      "discovered": "green",
      "awaiting_otp": "amber"
    }
  }
}
